{
  "schemaVersion": "0.1",
  "pack": {
    "apiVersion": "ohmy.dev/v0alpha1",
    "kind": "IndustryPack",
    "metadata": {
      "name": "oh-my-social",
      "version": "0.2.0",
      "maintainer": "Oh My Grok Bot project",
      "license": "UNLICENSED",
      "description": "Core plus social research and publication draft workflows; no live publishing.",
      "verification": "reviewed"
    },
    "spec": {
      "providers": ["grokbot"],
      "requirements": [
        {
          "capability": "source-research",
          "range": "^0.2.0",
          "optional": false
        },
        {
          "capability": "fact-verification",
          "range": "^0.2.0",
          "optional": false
        },
        {
          "capability": "task-planning",
          "range": "^0.2.0",
          "optional": false
        },
        {
          "capability": "agent-handoff",
          "range": "^0.2.0",
          "optional": false
        },
        {
          "capability": "artifact-validation",
          "range": "^0.2.0",
          "optional": false
        },
        {
          "capability": "failure-recovery",
          "range": "^0.2.0",
          "optional": false
        },
        {
          "capability": "approval-protocol",
          "range": "^0.2.0",
          "optional": false
        },
        {
          "capability": "cost-awareness",
          "range": "^0.2.0",
          "optional": false
        },
        {
          "capability": "capability-selection",
          "range": "^0.2.0",
          "optional": false
        },
        {
          "capability": "environment-bootstrap",
          "range": "^0.2.0",
          "optional": false
        },
        {
          "capability": "secret-handling",
          "range": "^0.2.0",
          "optional": false
        },
        {
          "capability": "routine-design",
          "range": "^0.2.0",
          "optional": false
        },
        {
          "capability": "social-research",
          "range": "^0.2.0",
          "optional": false
        },
        {
          "capability": "social-publishing",
          "range": "^0.2.0",
          "optional": false
        },
        {
          "capability": "x-public-search",
          "range": "*",
          "optional": false
        }
      ],
      "agents": [
        {
          "id": "social-researcher",
          "mission": "Produce cited social research and reviewable drafts using authorized read tools.",
          "skills": [
            "source-research",
            "fact-verification",
            "task-planning",
            "agent-handoff",
            "artifact-validation",
            "failure-recovery",
            "approval-protocol",
            "cost-awareness",
            "capability-selection",
            "environment-bootstrap",
            "secret-handling",
            "routine-design",
            "social-research",
            "social-publishing"
          ],
          "expectedOutputs": [
            "Cited social evidence and coverage limits",
            "Platform-specific drafts and exact approval proposal"
          ]
        }
      ],
      "policies": [
        "approval-before-external-actions",
        "no-plaintext-secrets",
        "verify-before-completion",
        "reconcile-before-retry"
      ]
    }
  },
  "provider": "grokbot",
  "registryDigest": "e86c613c5be7976d35c29a9d9918a52177bb3b0498bc5aafc660cd8f2f198a2f",
  "capabilities": [
    {
      "id": "source-research",
      "version": "0.2.0",
      "kind": "skill",
      "source": "ohmy-local",
      "description": "Research a question across permitted sources and return dated, traceable evidence.",
      "provides": ["source-research"],
      "dependencies": [],
      "permissions": ["workspace-read", "public-source-read"],
      "risk": 0,
      "providerSupport": {
        "grokbot": "manual",
        "muse": "unknown"
      },
      "verification": "reviewed",
      "delivery": {
        "mode": "bundled",
        "directory": "skills/source-research"
      }
    },
    {
      "id": "fact-verification",
      "version": "0.2.0",
      "kind": "skill",
      "source": "ohmy-local",
      "description": "Check claims, numbers, dates and source conflicts before delivery.",
      "provides": ["fact-verification"],
      "dependencies": [],
      "permissions": ["workspace-read", "public-source-read"],
      "risk": 0,
      "providerSupport": {
        "grokbot": "manual",
        "muse": "unknown"
      },
      "verification": "reviewed",
      "delivery": {
        "mode": "bundled",
        "directory": "skills/fact-verification"
      }
    },
    {
      "id": "task-planning",
      "version": "0.2.0",
      "kind": "skill",
      "source": "ohmy-local",
      "description": "Turn an objective into owned steps with concrete inputs, outputs and acceptance checks.",
      "provides": ["task-planning"],
      "dependencies": [],
      "permissions": ["workspace-read"],
      "risk": 0,
      "providerSupport": {
        "grokbot": "manual",
        "muse": "unknown"
      },
      "verification": "reviewed",
      "delivery": {
        "mode": "bundled",
        "directory": "skills/task-planning"
      }
    },
    {
      "id": "agent-handoff",
      "version": "0.2.0",
      "kind": "skill",
      "source": "ohmy-local",
      "description": "Hand off an authorized task with ownership, context and verifiable expected output.",
      "provides": ["agent-handoff"],
      "dependencies": [],
      "permissions": ["workspace-read", "native-internal-message"],
      "risk": 1,
      "providerSupport": {
        "grokbot": "manual",
        "muse": "unknown"
      },
      "verification": "reviewed",
      "delivery": {
        "mode": "bundled",
        "directory": "skills/agent-handoff"
      }
    },
    {
      "id": "artifact-validation",
      "version": "0.2.0",
      "kind": "skill",
      "source": "ohmy-local",
      "description": "Validate a deliverable through its actual use surface before claiming completion.",
      "provides": ["artifact-validation"],
      "dependencies": [],
      "permissions": ["workspace-read", "sandbox-execution"],
      "risk": 1,
      "providerSupport": {
        "grokbot": "manual",
        "muse": "unknown"
      },
      "verification": "reviewed",
      "delivery": {
        "mode": "bundled",
        "directory": "skills/artifact-validation"
      }
    },
    {
      "id": "failure-recovery",
      "version": "0.2.0",
      "kind": "skill",
      "source": "ohmy-local",
      "description": "Diagnose failures, reconcile partial effects and retry a safe bounded step.",
      "provides": ["failure-recovery"],
      "dependencies": [],
      "permissions": ["workspace-read"],
      "risk": 0,
      "providerSupport": {
        "grokbot": "manual",
        "muse": "unknown"
      },
      "verification": "reviewed",
      "delivery": {
        "mode": "bundled",
        "directory": "skills/failure-recovery"
      }
    },
    {
      "id": "approval-protocol",
      "version": "0.2.0",
      "kind": "skill",
      "source": "ohmy-local",
      "description": "Prepare reviewable external actions and bind approval to exact content and destination.",
      "provides": ["approval-protocol"],
      "dependencies": [],
      "permissions": ["workspace-read"],
      "risk": 0,
      "providerSupport": {
        "grokbot": "manual",
        "muse": "unknown"
      },
      "verification": "reviewed",
      "delivery": {
        "mode": "bundled",
        "directory": "skills/approval-protocol"
      }
    },
    {
      "id": "cost-awareness",
      "version": "0.2.0",
      "kind": "skill",
      "source": "ohmy-local",
      "description": "Bound searches, execution time and paid usage with observable budgets.",
      "provides": ["cost-awareness"],
      "dependencies": [],
      "permissions": ["workspace-read"],
      "risk": 0,
      "providerSupport": {
        "grokbot": "manual",
        "muse": "unknown"
      },
      "verification": "reviewed",
      "delivery": {
        "mode": "bundled",
        "directory": "skills/cost-awareness"
      }
    },
    {
      "id": "capability-selection",
      "version": "0.2.0",
      "kind": "skill",
      "source": "ohmy-local",
      "description": "Select a reviewed existing capability by source, license, permissions and native fit.",
      "provides": ["capability-selection"],
      "dependencies": [],
      "permissions": ["workspace-read"],
      "risk": 0,
      "providerSupport": {
        "grokbot": "manual",
        "muse": "unknown"
      },
      "verification": "reviewed",
      "delivery": {
        "mode": "bundled",
        "directory": "skills/capability-selection"
      }
    },
    {
      "id": "environment-bootstrap",
      "version": "0.2.0",
      "kind": "skill",
      "source": "ohmy-local",
      "description": "Stage a pinned capability pack locally and verify native host setup separately.",
      "provides": ["environment-bootstrap"],
      "dependencies": [],
      "permissions": ["workspace-read"],
      "risk": 0,
      "providerSupport": {
        "grokbot": "manual",
        "muse": "unknown"
      },
      "verification": "reviewed",
      "delivery": {
        "mode": "bundled",
        "directory": "skills/environment-bootstrap"
      }
    },
    {
      "id": "secret-handling",
      "version": "0.2.0",
      "kind": "skill",
      "source": "ohmy-local",
      "description": "Use scoped credential references without leaking credentials into prompts or evidence.",
      "provides": ["secret-handling"],
      "dependencies": [],
      "permissions": ["workspace-read"],
      "risk": 0,
      "providerSupport": {
        "grokbot": "manual",
        "muse": "unknown"
      },
      "verification": "reviewed",
      "delivery": {
        "mode": "bundled",
        "directory": "skills/secret-handling"
      }
    },
    {
      "id": "routine-design",